match,direction,minute,incident,verdict,source
Saudi Arabia (group),for,6,Abdulhamid holding Paredes,soft,"ESPN VAR review: 'seemed to be another soft decision', questioned fit with VAR mandate"
Poland (group),for,36,Szczesny contact on Messi claiming cross,wrong,"ESPN VAR review: 'quite simply not the kind of incident the system was brought in for'; contact 'minimal'"
Netherlands (QF),for,73,Dumfries trip on Acuna,clear,"Widely accepted as a foul; no serious contemporaneous dispute"
Croatia (SF),for,32,Livakovic collision with Alvarez,debatable,"Pundits split: Shearer/Green/McCoist/Walton correct vs Neville/Keane/Wright not a penalty; Modric called referee 'a disaster'"
France (final),for,21,Dembele foul on Di Maria,soft,"ESPN VAR review: soft but upheld"
France (final),against,79,Otamendi foul on Kolo Muani,correct,"ESPN VAR review: correct; foul justified"
France (final),against,114,Montiel handball,correct,"ESPN VAR review: 'textbook example of a modern handball penalty'"
